{
  "title": { "en": "Apple Design", "uz": "Apple Design", "ru": "Apple Design" },
  "summary": {
    "en": "Apple’s approach to interface design and fluid, physical motion for the web: springs, gestures, materials, type, reduced motion.",
    "uz": "Appleʼning interfeys dizayni va jonli, fizik harakatga yondashuvi - veb uchun: prujinali animatsiya, imo-ishoralar, materiallar, tipografiya.",
    "ru": "Подход Apple к дизайну интерфейсов и живой физичной анимации для веба: пружины, жесты, материалы, типографика, reduced motion."
  },
  "category": "design",
  "author": { "name": "HEAD", "github": "anvarovali" },
  "featured": true,
  "badges": ["official"],
  "youtube": {}
}
